เด็ก ๆ ร่าเริง	The children are cheerful.	เด็ก (child) / ๆ (plural marker) / ร่าเริง (cheerful)
คุณ อยู่ ราศี อะไร	What is your zodiac sign?	คุณ (you) / อยู่ (are) / ราศี (zodiac sign) / อะไร (what)
จุดเทียน รำลึก ความหลัง	Light a candle to reminisce.	จุด (light) / เทียน (candle) / รำลึก (reminisce) / ความหลัง (memories)
รื้อ บ้าน เก่า วันนี้	Demolish the old house today.	รื้อ (dismantle) / บ้าน (house) / เก่า (old) / วันนี้ (today)
รถ รุ่น ใหม่	New model car.	รถ (car) / รุ่น (model) / ใหม่ (new)
รูปถ่าย นี้ สวยมาก	This photo is very beautiful.	รูปถ่าย (photograph) / นี้ (this) / สวยมาก (very beautiful)
การเรียนรู้แบบ รูปแบบ ใหม่	New learning model.	การเรียนรู้ (learning) / แบบ (style) / รูปแบบ (model) / ใหม่ (new)
อย่าวิ่ง เร็ว เกิน	Don't run too fast.	อย่า (don't) / วิ่ง (run) / เร็ว (fast) / เกิน (too)
เขา ยิ้ม เรื่อยๆ	He keeps smiling.	เขา (he) / ยิ้ม (smile) / เรื่อยๆ (continuously)
ค่า แรงงาน เพิ่มขึ้น	Labor costs have increased.	ค่า (cost) / แรงงาน (labor) / เพิ่มขึ้น (increase)
แรงเทียน สวย มาก ๆ	Rang Thien is very beautiful.	แรง (passion) / เทียน (candle) / สวย (beautiful) / มาก ๆ (very)
ฉัน ไป เที่ยว แรม หนึ่ง	I went on a trip for one night.	ฉัน (I) / ไป (go) / เที่ยว (travel) / แรม (overnight) / หนึ่ง (one)
เด็ก ป่วย เป็น โรคบิด	The child is sick with dysentery.	เด็ก (child) / ป่วย (sick) / เป็น (is) / โรคบิด (dysentery)
เด็ก ๆ ไป โรงเรียนอนุบาล	The children go to kindergarten.	เด็ก (child) / ๆ (plural marker) / ไป (go) / โรงเรียนอนุบาล (kindergarten)
เรา ไป โรงละคร 	We are going to the theater.	เรา (we) / ไป (go) / โรงละคร (theater)
ทำ ไร อยู่	What are you doing?	ทำ (do) / ไร (what) / อยู่ (currently or now)
ฤดูใบไม้ผลิ อากาศ สดชื่น	Spring weather is refreshing.	ฤดู (season) / ใบไม้ผลิ (spring) / อากาศ (weather) / สดชื่น (refreshing)
ฉัน ชอบ ฤดู ใบไม้ ร่วง	I like autumn.	ฉัน (I) / ชอบ (like) / ฤดูใบไม้ร่วง (autumn)
ฤดูฝน น่า เที่ยว มาก	The rainy season is very nice for traveling.	ฤดู (season) / ฝน (rain) / น่า (worth) / เที่ยว (travel) / มาก (very)
ฉัน ชอบ ฤดูหนาว	I like winter.	ฉัน (I) / ชอบ (like) / ฤดูหนาว (winter)
ลงทะเบียน วันนี้ ได้ที่ไหน	Where can I register today?	ลงทะเบียน (register) / วันนี้ (today) / ได้ที่ไหน (where)
น้ำหนัก ลดลง เรื่อย ๆ	Weight is continuously decreasing.	น้ำหนัก (weight) / ลดลง (decrease) / เรื่อย ๆ (continually)
ระวัง ลวก มือ นะ	Be careful not to scald your hand.	ระวัง (caution) / ลวก (scald) / มือ (hand) / นะ (particle)
ลวด ใช้ ใน งานศิลปะ	Wire is used in art.	ลวด (wire) / ใช้ (use) / ใน (in) / งานศิลปะ (artwork)
ลวดลาย สวยงาม มาก ๆ	Very beautiful patterns.	ลวดลาย (pattern) / สวยงาม (beautiful) / มาก ๆ (very)
ฉัน ดู ละคร ทุกวัน	I watch dramas every day.	ฉัน (I) / ดู (watch) / ละคร (drama) / ทุกวัน (every day)
ฉัน ชอบ กิน ละมุด	I like to eat sapodilla.	ฉัน (I) / ชอบ (like) / กิน (eat) / ละมุด (sapodilla)
รู้สึก ละอายใจ มาก	Feel very ashamed.	รู้สึก (feel) / ละอายใจ (ashamed) / มาก (very)
เขา ถูก จับ ลักทรัพย์	He was arrested for theft.	เขา (he) / ถูก (was) / จับ (caught) / ลักทรัพย์ (theft)
ลักษณะ นี้ น่าสนใจ	This feature is interesting.	ลักษณะ (characteristic) / นี้ (this) / น่าสนใจ (interesting)
ลัทธิ นี้ น่าสนใจ	This doctrine is interesting.	ลัทธิ (cult) / นี้ (this) / น่าสนใจ (interesting)
ลา ก่อน แล้ว พบ กัน ใหม่	Goodbye, see you again.	ลา (goodbye) / ก่อน (before) / แล้ว (then) / พบ (meet) / กัน (together) / ใหม่ (again)
กระโปรง มี ลาย สวย	The skirt has a beautiful pattern.	กระโปรง (skirt) / มี (has) / ลาย (pattern) / สวย (beautiful)
เขา ลาออก เมื่อวาน	He resigned yesterday.	เขา (he) / ลาออก (resigned) / เมื่อวาน (yesterday)
เขา รู้ ลำดับ เหตุการณ์	He knows the sequence of events.	เขา (he) / รู้ (knows) / ลำดับ (order) / เหตุการณ์ (events)
ลิ้นชัก อยู่ ที่ไหน	Where is the drawer?	ลิ้นชัก (drawer) / อยู่ (is) / ที่ไหน (where)
ลูกจ้าง มา ทำงาน	The employee came to work.	ลูกจ้าง (employee) / มา (come) / ทำงาน (to work)
ฉัน มี ลูกบอล	I have a ball.	ฉัน (I) / มี (have) / ลูกบอล (ball)
กระสุน กับ ลูกปืน	Bullet and ammunition.	กระสุน (bullet) / กับ (and) / ลูกปืน (cartridge)
ลูกพี่ลูกน้อง มาแล้ว	The cousin has arrived.	ลูกพี่ลูกน้อง (cousin) / มา (come) / แล้ว (already)
ลูกสะใภ้ ของ ฉัน	My daughter-in-law.	ลูกสะใภ้ (daughter-in-law) / ของ (of) / ฉัน (my)
ลูกหนี้ ต้อง ชำระหนี้	The debtor must pay the debt.	ลูกหนี้ (debtor) / ต้อง (must) / ชำระหนี้ (pay the debt)
เลขา ทำงาน เก่งมาก	The secretary is very good at her job.	เลขา (secretary) / ทำงาน (work) / เก่งมาก (very skillful)
กรุณา เลี้ยวขวา ครับ	Please turn right.	กรุณา (please) / เลี้ยว (turn) / ขวา (right) / ครับ (polite particle)
กรุณา เลี้ยวซ้าย หน้า	Please turn left ahead.	กรุณา (please) / เลี้ยว (turn) / ซ้าย (left) / หน้า (ahead)
การ เลือกตั้ง เริ่มต้น แล้ว	The election has begun.	การ (the) / เลือกตั้ง (election) / เริ่มต้น (begins) / แล้ว (already)
แล้วแต่ คุณ เลย	Up to you.	แล้วแต่ (up to) / คุณ (you) / เลย (indeed)
เครื่อง ประดับ ทำ จาก โลหะ	Jewelry made from metal.	เครื่อง (machine) / ประดับ (decoration) / ทำ (make) / จาก (from) / โลหะ (metal)
ไล่ หมา ออก ไป	Chase the dog away.	ไล่ (chase) / หมา (dog) / ออก (out) / ไป (go)
เขา ถูก ไล่ออก	He was fired.	เขา (he) / ถูก (was) / ไล่ออก (fired)
วงจร นี้ ไม่ สมบูรณ์	This circuit is incomplete.	วงจร (circuit) / นี้ (this) / ไม่ (not) / สมบูรณ์ (complete)
ฉัน รัก วรรณกรรม ไทย	I love Thai literature.	ฉัน (I) / รัก (love) / วรรณกรรม (literature) / ไทย (Thai)
วรรณคดี ไทย น่า อ่าน	Thai literature is worth reading.	วรรณคดี (literature) / ไทย (Thai) / น่า (worth) / อ่าน (reading)
วัตถุประสงค์ ของ งาน	The objective of the work.	วัตถุ (object) / ประสงค์ (purpose) / ของ (of) / งาน (work)
วันนี้ วัน พฤหัสบดี	Today is Thursday.	วันนี้ (today) / วันพฤหัสบดี (Thursday)
เสื้อผ้า วา ยาว แค่ ไหน	How long are the clothes?	เสื้อผ้า (clothes) / วายาว (long) / แค่ไหน (how much)
ระวัง วาจา ของ คุณ	Be careful of your words.	ระวัง (beware) / วาจา (speech) / ของ (of) / คุณ (you)
นักเรียน วิเคราะห์ ข้อมูล	Students analyze data.	นักเรียน (student) / วิเคราะห์ (analyze) / ข้อมูล (data)
พยาบาล คือ วิชาชีพ หนึ่ง	Nursing is a profession.	พยาบาล (nurse) / คือ (is) / วิชาชีพ (profession) / หนึ่ง (one)
วิญญาณ อยู่ ใน บ้าน	The spirit is in the house.	วิญญาณ (spirit) / อยู่ (is) / ใน (in) / บ้าน (house)
สาขา วิทยา คืออะไร	What is the branch of science?	สาขา (branch) / วิทยา (science) / คือ (is) / อะไร (what)
วิธี ทำ อาหาร ง่ายๆ	Easy cooking method.	วิธี (method) / ทำ (make) / อาหาร (food) / ง่ายๆ (easy)
วิธีการ ทำ อาหาร ง่าย	Easy cooking methods.	วิธีการ (method) / ทำ (make) / อาหาร (food) / ง่าย (easy)
ใช้ เวลา แค่ วินาที	Just take seconds.	ใช้ (use) / เวลา (time) / แค่ (just) / วินาที (seconds)
วิวัฒนาการ ของ มนุษย์	Evolution of humans.	วิวัฒนาการ (evolution) / ของ (of) / มนุษย์ (human)
นักร้อง ขึ้น เวที	The singer went on stage.	นักร้อง (singer) / ขึ้น (on) / เวที (stage)
วันนี้ เป็น เวลา ดี	Today is a good time.	วันนี้ (today) / เป็น (is) / เวลา (time) / ดี (good)
ฉัน ไว้ใจ คุณ	I trust you.	ฉัน (I) / ไว้ใจ (trust) / คุณ (you)
ฉัน ชอบ ดื่ม ไวน์	I like to drink wine.	ฉัน (I) / ชอบ (like) / ดื่ม (drink) / ไวน์ (wine)
อินเตอร์เน็ต ที่นี่ ไวไฟ	The internet here is Wi-Fi.	อินเตอร์เน็ต (Internet) / ที่นี่ (here) / ไวไฟ (Wi-Fi)
พบ ศพ ใน บ้าน	A body was found in the house.	พบ (found) / ศพ (corpse) / ใน (in) / บ้าน (house)
ฉัน ศรัทธา ใน คุณ	I have faith in you.	ฉัน (I) / ศรัทธา (faith) / ใน (in) / คุณ (you)
สุนัข กัด ศัตรู 	The dog bites the enemy.	สุนัข (dog) / กัด (bites) / ศัตรู (enemy)
วิทยา ศาสตร์ น่าสนใจ	Science is interesting.	วิทยา (science) / ศาสตร์ (science) / น่า (interesting) / สนใจ (interesting)
เขา รัก ศิลปะ	He loves art.	เขา (he) / รัก (loves) / ศิลปะ (art)
เขารักษา ศีล ห้า	He observes the Five Precepts.	เขา (he) / รักษา (observes) / ศีล (precepts) / ห้า (five)
ศึก กำลัง เริ่ม ขึ้น	The battle is beginning.	ศึก (battle) / กำลัง (is) / เริ่ม (beginning) / ขึ้น (up)
เขา รู้สึก เศร้า มาก	He feels very sad.	เขา (he/she/they) / รู้สึก (feel) / เศร้า (sad) / มาก (very)
ฉัน กิน เศษ ขนมปัง	I eat bread crumbs.	ฉัน (I) / กิน (eat) / เศษ (pieces) / ขนมปัง (bread)
ฉัน ส่งจดหมาย แล้ว	I have sent the letter already.	ฉัน (I) / ส่ง (send) / จดหมาย (letter) / แล้ว (already)
ทะเล สงบ มากวันนี้	The sea is very calm today.	ทะเล (sea) / สงบ (calm) / มาก (very) / วันนี้ (today)
เขา สงสัย อะไร	What is he suspicious of?	เขา (he) / สงสัย (suspect) / อะไร (what)
ฉัน สงสาร หมา จรจัด 	I feel sorry for stray dogs.	ฉัน (I) / สงสาร (feel sorry for) / หมา (dog) / จรจัด (stray)
โรงงาน ส่งออก ข้าว	Rice export factory.	โรงงาน (factory) / ส่งออก (export) / ข้าว (rice)
เธอ ยิ้ม อย่าง สดใส	She smiled brightly.	เธอ (you) / ยิ้ม (smile) / อย่าง (like) / สดใส (brightly)
จงมี สติ ทุกขณะ	Be mindful at every moment.	จง (must) / มี (have) / สติ (mindfulness) / ทุกขณะ (every moment)
สถานการณ์ น่า เป็น ห่วง	The situation is worrying.	สถานการณ์ (situation) / น่า (worthy of) / เป็นห่วง (worry)
กษัตริย์ สถาปนา ราชวงศ์ ใหม่	The king established a new dynasty.	กษัตริย์ (king) / สถาปนา (establish) / ราชวงศ์ (dynasty) / ใหม่ (new)
สถิติ สำคัญ มาก ๆ	Statistics are very important.	สถิติ (statistics) / สำคัญ (important) / มาก ๆ (very)
ผม สนใจ หนังสือ	I am interested in books.	ผม (I) / สนใจ (interested) / หนังสือ (book)
สนทนา กับ ครูวันนี้	Talk with the teacher today.	สนทนา (conversation) / กับ (with) / ครู (teacher) / วันนี้ (today)
สนามม้า อยู่ไหน คะ	Where is the horse racetrack?	สนาม (field) / ม้า (horse) / อยู่ (is) / ไหน (where) / คะ (question particle)
เขา รู้สึก สบายใจ	He feels at ease.	เขา (he/she/they) / รู้สึก (feel) / สบายใจ (comfortable/at ease)
เทคโนโลยี สมัยใหม่ ก้าวหน้า	Modern technology is advancing.	เทคโนโลยี (technology) / สมัยใหม่ (modern) / ก้าวหน้า (advanced)
ฉัน เป็น สมาชิก ใหม่	I am a new member.	ฉัน (I) / เป็น (am) / สมาชิก (member) / ใหม่ (new)
เขา เข้า สโมสร	He entered the club.	เขา (he) / เข้า (enter) / สโมสร (club)
ฉัน ใส่ สร้อยคอ	I wear a necklace.	ฉัน (I) / ใส่ (wear) / สร้อยคอ (necklace)
ฉัน ชอบ สลัด ผัก	I like vegetable salad.	ฉัน (I) / ชอบ (like) / สลัด (salad) / ผัก (vegetable)
เขา สวดมนต์ ทุกวัน	He prays every day.	เขา (he) / สวดมนต์ (pray) / ทุกวัน (every day)
ฉัน ไป สวนสัตว์	I go to the zoo.	ฉัน (I) / ไป (go) / สวนสัตว์ (zoo)
คน ส่วนใหญ่ ชอบ ชา	Most people like tea.	คน (people) / ส่วนใหญ่ (majority) / ชอบ (like) / ชา (tea)
ฉัน สวม เสื้อเชิ้ต	I am wearing a shirt.	ฉัน (I) / สวม (wear) / เสื้อเชิ้ต (shirt)
บริษัท มี สวัสดิการ ที่ ดี	The company has good welfare benefits.	บริษัท (Company) / มี (has) / สวัสดิการ (benefits) / ที่ (that) / ดี (good)
สองแถว จอด อยู่ไหน	Where is the songthaew parked?	สองแถว (songthaew) / จอด (park) / อยู่ไหน (where)
ตำรวจ สอบสวน คดี นี้	Police are investigating this case.	ตำรวจ (police) / สอบสวน (investigate) / คดี (case) / นี้ (this)
เขา เจาะ สะดือ	He pierced his navel.	เขา (he) / เจาะ (pierced) / สะดือ (navel)
เธอ เป็น สะใภ้ ใหม่	She is the new daughter-in-law.	เธอ (she) / เป็น (is) / สะใภ้ (daughter-in-law) / ใหม่ (new)
ขอ สัก แก้ว ค่ะ	"One glass, please."	ขอ (may I have) / สัก (a) / แก้ว (glass) / ค่ะ (please)
สังคม ไทย น่าอยู่	Thai society is pleasant.	สังคม (society) / ไทย (Thai) / น่าอยู่ (livable)
สัดส่วน เท่ากัน ทุกคน	Equal parts for everyone.	สัดส่วน (proportion) / เท่ากัน (equal) / ทุกคน (everyone)
โทรศัพท์ ของฉัน สั่น	My phone is vibrating.	โทรศัพท์ (phone) / ของ (of) / ฉัน (my) / สั่น (vibrating)
ฉัน รู้สึก สับสน มาก	I feel very confused.	ฉัน (I) / รู้สึก (feel) / สับสน (confused) / มาก (very)
สาขา นี้ เปิดใหม่	This branch is newly opened.	สาขา (branch) / นี้ (this) / เปิดใหม่ (newly opened)
สาด น้ำ เล่น กัน	Splash water and play together.	สาด (splash) / น้ำ (water) / เล่น (play) / กัน (together)
ถนน ตรง สามแยก	The road at the T-junction.	ถนน (road) / ตรง (straight) / สามแยก (T-junction)
รูป สามเหลี่ยม สวย มาก	The triangle is very beautiful.	รูป (shape) / สามเหลี่ยม (triangle) / สวย (beautiful) / มาก (very)
เธอ สวย จน สายตา	She is so beautiful to the eyes.	เธอ (you) / สวย (beautiful) / จน (until) / สายตา (glance)
เขา สารภาพ ความจริง	He confessed the truth.	เขา (he) / สารภาพ (confessed) / ความจริง (the truth)
ฉัน ทำงาน ที่ สำนักงาน 	I work at the office.	ฉัน (I) / ทำงาน (work) / ที่ (at) / สำนักงาน (office)
สิ่ง นี้ ดี มาก	This is very good.	สิ่ง (thing) / นี้ (this) / ดี (good) / มาก (very)
สิงโต อยู่ ที่ไหน	Where is the lion?	สิงโต (lion) / อยู่ (is) / ที่ไหน (where)
จะ จ่าย เงิน สิ้นเดือน	Will pay at the end of the month.	จะ (will) / จ่าย (pay) / เงิน (money) / สิ้นเดือน (end of the month)
เขา ตื่น ตอน สิบสอง โมง	He wakes up at noon.	เขา (he) / ตื่น (wake up) / ตอน (at) / สิบสอง (twelve) / โมง (o'clock)
เขา อายุ สิบเอ็ด ปี	He is eleven years old.	เขา (he) / อายุ (is aged) / สิบ (ten) / เอ็ด (one) / ปี (years)
ท้องฟ้า สีคราม สวย	The sky is beautifully blue.	ท้องฟ้า (sky) / สีคราม (indigo) / สวย (beautiful)
เสื้อ ตัว นี้ สี ตก	This shirt's color has faded.	เสื้อ (shirt) / ตัว (classifier for clothes) / นี้ (this) / สี (color) / ตก (fade)
เขาอายุ สี่สิบ ปี	He is forty years old.	เขา (he) / อายุ (age) / สี่สิบ (forty) / ปี (year)
ตำรวจ สืบ คดีนี้	The police investigate this case.	ตำรวจ (police) / สืบ (investigate) / คดีนี้ (this case)
สื่อ มี อิทธิพล มาก	Media has a lot of influence.	สื่อ (media) / มี (has) / อิทธิพล (influence) / มาก (a lot)
เรา สื่อสาร ทางอินเทอร์เน็ต	We communicate via the internet.	เรา (we) / สื่อสาร (communicate) / ทาง (via) / อินเทอร์เน็ต (internet)
เธอ น่า รัก ที่ สุด	You are the cutest.	เธอ (you) / น่ารัก (cute) / ที่สุด (most)
สุภาพสตรี คือ ผู้หญิง	Lady means woman.	สุภาพสตรี (lady) / คือ (is) / ผู้หญิง (woman)
ความเร็ว สูงสุด เท่าไหร่	What is the maximum speed?	ความเร็ว (speed) / สูงสุด (maximum) / เท่าไหร่ (how much)
สูตร อาหาร อร่อย มาก	Delicious recipe.	สูตร (recipe) / อาหาร (food) / อร่อย (delicious) / มาก (very)
ฉัน กิน เส้นหมี่	I eat rice noodles.	ฉัน (I) / กิน (eat) / เส้นหมี่ (rice noodle)
เสาร์ อาทิตย์ ฉัน ไป เที่ยว	Saturday and Sunday, I go on a trip.	เสาร์ (Saturday) / อาทิตย์ (Sunday) / ฉัน (I) / ไป (go) / เที่ยว (travel)
เสียง สูง ต่ำ น่า สนใจ	The high and low sounds are interesting.	เสียง (sound) / สูง (high) / ต่ำ (low) / น่า (interesting) / สนใจ (interest)
เสียดาย เวลา ที่เสียไป	Regret the time that was lost.	เสียดาย (regretful) / เวลา (time) / ที่ (that) / เสียไป (lost)
บ้าน เสียหาย มาก	The house is badly damaged.	บ้าน (house) / เสียหาย (damaged) / มาก (very)
เสือดาว วิ่ง ใน ป่า	The leopard runs in the forest.	เสือดาว (leopard) / วิ่ง (runs) / ใน (in) / ป่า (forest)
สุขภาพ เริ่ม เสื่อม แล้ว	Health is starting to deteriorate.	สุขภาพ (health) / เริ่ม (begin) / เสื่อม (deteriorate) / แล้ว (already)
ฉัน ชอบ เสื้อยืด	I like T-shirts.	ฉัน (I) / ชอบ (like) / เสื้อยืด (T-shirt)
ฉัน ชอบ ไส้กรอก	I like sausages.	ฉัน (I) / ชอบ (like) / ไส้กรอก (sausage)
อายุ เขา หกสิบ ปี	He is sixty years old.	อายุ (age) / เขา (he) / หกสิบ (sixty) / ปี (year)
ฉัน รู้สึก หนักใจ	I feel burdened.	ฉัน (I) / รู้สึก (feel) / หนักใจ (troubled)
หน้าผาก ของ เขา กว้าง	His forehead is wide.	หน้าผาก (forehead) / ของ (of) / เขา (his) / กว้าง (wide)
เขา หนี ออก ไป	He ran away.	เขา (he) / หนี (escape) / ออก (out) / ไป (go)
หมายถึง อะไร ครับ/คะ	What does it mean?	หมายถึง (mean) / อะไร (what) / ครับ (polite particle for males) / คะ (polite particle for females)
หมี อาศัย ใน ป่า	A bear lives in the forest.	หมี (bear) / อาศัย (live) / ใน (in) / ป่า (forest)
อย่า บอก ว่า อยาก หย่า	Don't say you want a divorce.	อย่า (don't) / บอก (tell) / ว่า (that) / อยาก (want) / หย่า (divorce)
เรา ควร หยุด พัก	We should take a break.	เรา (we) / ควร (should) / หยุด (stop) / พัก (rest)
เขา หลอก ฉัน อีก	He fooled me again.	เขา (he) / หลอก (deceives) / ฉัน (me) / อีก (again)
หลักสูตร นี้ ยาก มาก	This course is very difficult.	หลักสูตร (course) / นี้ (this) / ยาก (difficult) / มาก (very)
หลังจาก ฝน ตก นาน	After a long rain.	หลังจาก (after) / ฝน (rain) / ตก (falls) / นาน (long)
หลังจากนั้น ฉัน จะ ไป	After that, I will go.	หลังจากนั้น (after that) / ฉัน (I) / จะ (will) / ไป (go)
เราจะไป หลังจากนี้  	We will go after this.	เรา (we) / จะ (will) / ไป (go) / หลังจากนี้ (after this)
