เขา ถีบ ลูกบอล	He kicked the ball.	เขา (he) / ถีบ (kick) / ลูกบอล (ball)
ถึง แม้ว่า ฝน จะ ตก	Even though it is raining.	ถึง (even) / แม้ (though) / ว่า (that) / ฝน (rain) / จะ (will) / ตก (fall)
เถียง กับ พี่สาว	Argue with sister. 	เถียง (argue) / กับ (with) / พี่สาว (sister)
มี ร้านอาหาร แถว นั้น ไหม	Is there a restaurant around there?	มี (is there) / ร้านอาหาร (restaurant) / แถว (area) / นั้น (there) / ไหม (question particle)
เตียง ไม้ ทนทาน ถาวร	Durable wooden bed.	เตียง (bed) / ไม้ (wood) / ทนทาน (durable) / ถาวร (permanent)
ทรัพยากร มีค่า มาก	Resources are very valuable.	ทรัพยากร (resources) / มี (has) / ค่า (value) / มาก (much)
น้ำ ท่วม ถนน อีกแล้ว	The road is flooded again.	น้ำ (water) / ท่วม (flood) / ถนน (road) / อีกแล้ว (again)
ทหาร เรือ ทำ อาหาร เก่ง	The sailor is good at cooking.	ทหารเรือ (navy)/ ทำ (make)/ อาหาร (food)/ เก่ง (skilled)
พ่อ ของ ฉัน เป็น ทหาร อากาศ	My father is an airman.	พ่อ (father) / ของ (of) / ฉัน (my) / เป็น (is) / ทหาร (soldier) / อากาศ (air)
แม่ ทอ ผ้า สวย	Mother weaves beautiful cloth.	แม่ (mother) / ทอ (weave) / ผ้า (cloth) / สวย (beautiful)
ท่อ น้ำ รั่ว แล้ว	The water pipe is leaking.	ท่อ (pipe) / น้ำ (water) / รั่ว (leaking) / แล้ว (already)
นักเรียน ท่องจำ บทเรียน	Students memorize the lesson.	นักเรียน (student) / ท่องจำ (memorize) / บทเรียน (lesson)
ท่อน้ำ รั่ว อีกแล้ว	The pipe is leaking again.	ท่อน้ำ (pipe) / รั่ว (leak) / อีกแล้ว (again)
เลข ทะเบียน รถ ใหม่	New car registration number.	เลข (number) / ทะเบียน (registration) / รถ (car) / ใหม่ (new)
ทะเลสาบ สวย มาก ๆ	The lake is very beautiful.	ทะเลสาบ (lake) / สวย (beautiful) / มาก ๆ (very)
เขา อ่าน หนังสือ ทั้งคืน	He read the book all night.	เขา (he) / อ่าน (read) / หนังสือ (book) / ทั้งคืน (all night)
เธอ ทำงาน ทั้งวัน	She works all day.	เธอ (she) / ทำงาน (works) / ทั้งวัน (all day)
ฉัน รัก เธอ ทั้งหมด ทั้งสิ้น	I love all of you entirely.	ฉัน (I) / รัก (love) / เธอ (you) / ทั้งหมด (all) / ทั้งสิ้น (entirely)
ท่าน ทั้งหลาย โปรด ฟัง	Ladies and gentlemen, please listen.	ท่าน (you) / ทั้งหลาย (all) / โปรด (please) / ฟัง (listen)
เดินทาง ทั่ว ประเทศไทย	Travel all over Thailand.	เดินทาง (travel) / ทั่ว (all over) / ประเทศไทย (Thailand)
การ ใช้ งาน ทั่วไป	General use.	การ (use) / ใช้ (using) / งาน (work) / ทั่วไป (general)
ท่า นี้ สวย มาก	This pose is very beautiful.	ท่า (pose) / นี้ (this) / สวย (beautiful) / มาก (very)
เลี้ยว ทางขวา ครับ	Turn right, sir.	เลี้ยว (turn) / ทาง (way) / ขวา (right) / ครับ (sir)
เลี้ยว ทางซ้าย ตรงนั้น	Turn left there.	เลี้ยว (turn) / ทาง (way) / ซ้าย (left) / ตรงนั้น (there)
มา ทาง นี้ หน่อย สิ	Come this way a bit.	มา (come) / ทางนี้ (this way) / หน่อย (a bit) / สิ (please)
ฉัน จะ ไป ทางโน้น	I will go that way.	ฉัน (I) / จะ (will) / ไป (go) / ทางโน้น (that way)
เรา นั่ง ทางรถไฟ	We take the train.	เรา (we) / นั่ง (sit) / ทางรถไฟ (railway)
ทานข้าว กับ เพื่อน	Have a meal with friends.	ทาน (eat) / ข้าว (rice) / กับ (with) / เพื่อน (friend)
ฉัน ชอบ ทำกับข้าว	I like cooking.	ฉัน (I) / ชอบ (like) / ทำกับข้าว (cook)
ทิศ ใต้ มี ฝน	South has rain.	ทิศ (direction) / ใต้ (south) / มี (has) / ฝน (rain)
ที่ตั้ง อยู่ ใน เมือง	Located in the city.	ที่ตั้ง (location) / อยู่ (is) / ใน (in) / เมือง (city)
แม่ ใช้ ที่ตีไข่	Mom uses a whisk.	แม่ (mother) / ใช้ (use) / ที่ตีไข่ (egg beater)
เชียงใหม่ มี ที่เที่ยว	Chiang Mai has tourist attractions.	เชียงใหม่ (Chiang Mai) / มี (have) / ที่เที่ยว (attractions)
ที่พัก อยู่ ใกล้ ชายหาด	The accommodation is near the beach.	ที่พัก (accommodation) / อยู่ (is) / ใกล้ (near) / ชายหาด (beach)
ทีม ของ ฉัน แข็งแกร่ง	My team is strong.	ทีม (team) / ของ (of) / ฉัน (my) / แข็งแกร่ง (strong)
ทีแรก ฉัน ไม่ รู้	At first, I didn't know.	ทีแรก (at first) / ฉัน (I) / ไม่ (not) / รู้ (know)
เขา ได้ ที่ หนึ่ง	He got first place.	เขา (he/she/they) / ได้ (got) / ที่ (place) / หนึ่ง (one)
ทุกคน ยิ้ม อย่าง มีความสุข	Everyone smiles happily.	ทุกคน (everyone) / ยิ้ม (smile) / อย่าง (like) / มีความสุข (happy)
ฉัน ไป ทุกที่	I go everywhere.	ฉัน (I) / ไป (go) / ทุกที่ (everywhere)
ทุก สิ่ง เป็น ไป ได้	Everything is possible.	ทุก (everything) / สิ่ง (thing) / เป็นไปได้ (possible)
ฉัน ชอบ ทุกอย่าง	I like everything.	ฉัน (I) / ชอบ (like) / ทุกอย่าง (everything)
โดย ไม่ มี ความ รู้สึก ผิด	Without any guilt.	โดย (by) / ไม่ (not) / มี (have) / ความรู้สึก (feeling) / ผิด (wrong)
เธอ เท น้ำ	She pours water.	เธอ (you) / เท (pour) / น้ำ (water)
เทคโนโลยี ก้าวหน้า อย่างรวดเร็ว	Technology is advancing rapidly.	เทคโนโลยี (technology) / ก้าวหน้า (advance) / อย่าง (ad) / รวดเร็ว (quickly)
เขา เล่น เทนนิส	He plays tennis.	เขา (he) / เล่น (play) / เทนนิส (tennis)
ฉัน ฟัง เทป นี้	I listen to this tape.	ฉัน (I) / ฟัง (listen) / เทป (tape) / นี้ (this)
ฉันทำได้ เท่าที่ ฉันจะทำ	I can do what I can do.	ฉัน (I) / ทำได้ (can do) / เท่าที่ (as much as) / ฉัน (I) / จะ (will) / ทำ (do)
นี่ ราคา เท่าไหร่	How much is this?	นี่ (this) / ราคา (price) / เท่าไหร่ (how much)
ความ สูง ของ เขา เทียบ เรา ไม่ได้	His height cannot compare to ours.	ความ (height) / สูง (high) / ของ (of) / เขา (him) / เทียบ (compare) / เรา (us) / ไม่ได้ (cannot)
ของ แท้ แน่นอน	Authentic for sure.	ของ (thing) / แท้ (genuine) / แน่นอน (certain)
เด็ก แทง ลูกบอล	The child stabs the ball.	เด็ก (child) / แทง (stab) / ลูกบอล (ball)
เขา แทบ จะ ล้ม	He almost fell.	เขา (he) / แทบ (almost) / จะ (will) / ล้ม (fall)
รัก ธรรมชาติ มาก ๆ	Love nature very much.	รัก (love) / ธรรมชาติ (nature) / มาก (very) / ๆ (much)
ธรรมเนียม ของ ชาวญี่ปุ่น	Japanese customs.	ธรรมเนียม (custom) / ของ (of) / ชาวญี่ปุ่น (Japanese people)
นกแก้ว ของ ฉัน สวย	My parrot is beautiful.	นกแก้ว (parrot) / ของ (of) / ฉัน (my) / สวย (beautiful)
นกยูง สวย มาก ๆ	Peacocks are very beautiful.	นกยูง (peacock) / สวย (beautiful) / มาก ๆ (very)
นกฮูก น่ารัก มาก ๆ	Owls are very cute.	นกฮูก (owl) / น่ารัก (cute) / มาก ๆ (very)
เขา รัก น้องสะใภ้	He loves his sister-in-law.	เขา (He) / รัก (loves) / น้องสะใภ้ (sister-in-law)
มี เวลา น้อย กว่า เขา	Have less time than him.	มี (have) / เวลา (time) / น้อยกว่า (less than) / เขา (him)
นักการเมือง พูด ที่สภา	A politician spoke at the parliament.	นักการเมือง (politician) / พูด (speak) / ที่ (at) / สภา (parliament)
เธอ เป็น นักแปล	She is a translator.	เธอ (you) / เป็น (is) / นักแปล (translator)
สินค้านี้ น่าซื้อ มาก	This product is very worth buying.	สินค้านี้ (this product) / น่าซื้อ (worth buying) / มาก (very)
เทศกาล นานาชาติ สนุกมาก	The international festival is very fun.	เทศกาล (festival) / นานาชาติ (international) / สนุกมาก (very fun)
เสียง ของคุณ น่าฟัง	Your voice is pleasant to listen to.	เสียง (sound) / ของ (of) / คุณ (you) / น่าฟัง (pleasant to hear)
นายกรัฐมนตรี เดินทาง ไป ญี่ปุ่น	The Prime Minister traveled to Japan.	นายกรัฐมนตรี (Prime Minister) / เดินทาง (travel) / ไป (to) / ญี่ปุ่น (Japan)
นายจ้าง ใจดี มาก ๆ	The employer is very kind.	นายจ้าง (employer) / ใจดี (kind) / มาก (very) / ๆ (very)
เสียง นาฬิกา น่ารำคาญ	The sound of the clock is annoying.	เสียง (sound) / นาฬิกา (clock) / น่ารำคาญ (annoying)
เกม นี้ น่าเสียใจ	This game is disappointing.	เกม (game) / นี้ (this) / น่าเสียใจ (regrettable)
เขา ไม่มา น่าเสียดาย	He didn't come, what a pity.	เขา (he) / ไม่มา (did not come) / น่าเสียดาย (unfortunately)
นาฬิกาปลุก ดัง แล้ว	The alarm clock has gone off.	นาฬิกา (clock) / ปลุก (wake) / ดัง (loud) / แล้ว (already)
หนังสือ เล่ม นี้ น่าอ่าน	This book is worth reading.	หนังสือ (book) / เล่ม (volume) / นี้ (this) / น่าอ่าน (worth reading)
เรา นำเข้า เครื่องใช้ไฟฟ้า	We import electrical appliances.	เรา (we) / นำเข้า (import) / เครื่องใช้ไฟฟ้า (electronic appliances)
ฉัน ชอบ น้ำเชื่อม	I like syrup.	ฉัน (I) / ชอบ (like) / น้ำเชื่อม (syrup)
ชอบ ดื่ม น้ำ โซดา	Like to drink soda water.	ชอบ (like) / ดื่ม (drink) / น้ำ (water) / โซดา (soda)
ฉัน ชอบ ดื่ม น้ำ มะนาว	I like to drink lemonade.	ฉัน (I) / ชอบ (like) / ดื่ม (drink) / น้ำ (water) / มะนาว (lemon)
ฉัน ชอบ ดื่ม น้ำอัดลม	I like drinking soda.	ฉัน (I) / ชอบ (like) / ดื่ม (drink) / น้ำอัดลม (soda)
นิกาย นี้ สอน อะไร	What does this sect teach?	นิกาย (sect) / นี้ (this) / สอน (teach) / อะไร (what)
ฉัน ชอบ อ่าน นิตยสาร	I like reading magazines.	ฉัน (I) / ชอบ (like) / อ่าน (read) / นิตยสาร (magazine)
แม่ นิมนต์ พระ มา	Mother invited a monk to come.	แม่ (mother) / นิมนต์ (invite) / พระ (monk) / มา (come)
ฉัน มี นิ้วมือ สวย	I have beautiful fingers.	ฉัน (I) / มี (have) / นิ้วมือ (fingers) / สวย (beautiful)
นิสัย เขา ดีมาก	His personality is very good.	นิสัย (habit) / เขา (he) / ดีมาก (very good)
ข้าว นึ่ง หอม มาก	The steamed rice is very fragrant.	ข้าว (rice) / นึ่ง (steamed) / หอม (fragrant) / มาก (very)
ขนมปัง นี้ นุ่ม มาก	This bread is very soft.	ขนมปัง (bread) / นี้ (this) / นุ่ม (soft) / มาก (very)
เนื้อผ้า นี้ นุ่มมาก	This fabric is very soft.	เนื้อผ้า (fabric) / นี้ (this) / นุ่มมาก (very soft)
ฉัน ชอบ กิน เนื้อ วัว	I like eating beef.	ฉัน (I) / ชอบ (like) / กิน (eat) / เนื้อวัว (beef)
ห้อง นี้ คน แน่น มาก	This room is very crowded.	ห้อง (room) / นี้ (this) / คน (people) / แน่น (crowded) / มาก (very)
แนวทาง ใหม่ ของเรา	Our new approach.	แนวทาง (approach) / ใหม่ (new) / ของเรา (our)
แนวโน้ม เศรษฐกิจ ดีขึ้น	The economic outlook is improving.	แนวโน้ม (trend) / เศรษฐกิจ (economy) / ดีขึ้น (improve)
บ้าน ของ เขา โน้น	His house over there.	บ้าน (house) / ของ (of) / เขา (his) / โน้น (yonder)
เขา อ่าน หนังสือ ในขณะที่	He reads a book while.	เขา (he, she, or they) / อ่าน (read) / หนังสือ (book) / ในขณะที่ (while)
เขา ถึง ที่นั่น ในที่สุด	He finally arrived there.	เขา (he) / ถึง (arrived) / ที่นั่น (there) / ในที่สุด (finally)
ใน ระหว่าง การ เดินทาง	During the journey.	ใน (in/between) / ระหว่าง (during) / การ (the) / เดินทาง (journey/travel)
ทหาร บก กำลัง ฝึก	The army is training.	ทหาร (soldier) / บก (land) / กำลัง (is) / ฝึก (training)
บทเรียน นี้ น่าสนใจ	This lesson is interesting.	บทเรียน (lesson) / นี้ (this) / น่าสนใจ (interesting)
ฉัน บรรจุ เสื้อผ้า	I packed clothes.	ฉัน (I) / บรรจุ (pack) / เสื้อผ้า (clothes)
บรรดา เพื่อน ๆ มาด้วย	All the friends came along.	บรรดา (all) / เพื่อน (friends) / ๆ (plural marker) / มา (come) / ด้วย (with)
บรรพบุรุษ ของ เรา	Our ancestors.	บรรพบุรุษ (ancestors) / ของ (of) / เรา (our)
บริการ ดี มาก	Very good service.	บริการ (service) / ดี (good) / มาก (very)
บริโภค ผลไม้ วันละสองหน่วย	Consume two servings of fruit a day.	บริโภค (consume) / ผลไม้ (fruit) / วันละ (per day) / สอง (two) / หน่วย (portion)
บะหมี่ อร่อย มาก ๆ	The noodles are very delicious.	บะหมี่ (noodles) / อร่อย (delicious) / มาก (very) / ๆ (very)
เรา บังเอิญ เจอ กัน	We happened to meet.	เรา (we) / บังเอิญ (accidentally) / เจอ (meet) / กัน (each other)
ฉัน ลืม บัตร นักเรียน	I forgot my student card.	ฉัน (I) / ลืม (forgot) / บัตร (card) / นักเรียน (student)
ชำระ บัตรเครดิต ได้ไหม	Can I pay by credit card?	ชำระ (pay) / บัตรเครดิต (credit card) / ได้ไหม (can)
ดอกไม้ บาน ตอน เช้า	Flowers bloom in the morning.	ดอกไม้ (flower) / บาน (bloom) / ตอน (at) / เช้า (morning)
บ้านเลขที่ นี้ สวยมาก	This house number is very beautiful.	บ้าน (house) / เลขที่ (number) / นี้ (this) / สวย (beautiful) / มาก (very)
บิดา มารดา รัก ลูก มาก	Parents love their children very much.	บิดา (father) / มารดา (mother) / รัก (love) / ลูก (child) / มาก (very)
เขา บีบ หลอด ยาสีฟัน	He squeezed the toothpaste tube.	เขา (he) / บีบ (squeeze) / หลอด (tube) / ยาสีฟัน (toothpaste)
บุรุษ ไปรษณีย์ มา ส่ง จดหมาย	The postman delivered the letter.	บุรุษ (man) / ไปรษณีย์ (postal) / มา (come) / ส่ง (deliver) / จดหมาย (letter)
เบาะ รถ นุ่ม มาก	The car seat is very soft.	เบาะ (seat) / รถ (car) / นุ่ม (soft) / มาก (very)
แบ่ง ขนม กับ เพื่อน	Share snacks with friends.	แบ่ง (share) / ขนม (snack) / กับ (with) / เพื่อน (friend)
กรุณา กรอก แบบฟอร์ม	Please fill out the form.	กรุณา (please) / กรอก (fill) / แบบฟอร์ม (form)
ฉัน ชอบ เล่น โบว์ลิ่ง	I like bowling.	ฉัน (I) / ชอบ (like) / เล่น (play) / โบว์ลิ่ง (bowling)
แกงเขียวหวาน ใส่ ใบมะกรูด	Green curry with kaffir lime leaves.	แกงเขียวหวาน (green curry) / ใส่ (add) / ใบมะกรูด (kaffir lime leaves)
คุณ มี ใบเสร็จ ไหม	Do you have a receipt?	คุณ (you) / มี (have) / ใบเสร็จ (receipt) / ไหม (question particle)
ปก หนังสือ สวย มาก	The book cover is very beautiful.	ปก (cover) / หนังสือ (book) / สวย (beautiful) / มาก (very)
อาหาร ประกอบด้วย เนื้อสัตว์	The food contains meat.	อาหาร (food) / ประกอบด้วย (consists of) / เนื้อสัตว์ (meat)
รถ คัน นี้ มี ประกัน	This car has insurance.	รถ (car) / คันนี้ (this) / มี (has) / ประกัน (insurance)
ประชากร เพิ่ม จำนวน	Population increases.	ประชากร (population) / เพิ่ม (increase) / จำนวน (number)
ประชาชน ร่วมมือ กัน	The people cooperate.	ประชาชน (People) / ร่วมมือ (Cooperate) / กัน (Together)
ฉัน เรียน ชั้น ประถม	I study in elementary school.	ฉัน (I) / เรียน (study) / ชั้น (grade) / ประถม (elementary)
นักเรียน ประพฤติ ดี	Students behave well.	นักเรียน (student) / ประพฤติ (behave) / ดี (well)
ฉัน ประมูล ของเก่า	I auction antiques.	ฉัน (I) / ประมูล (bid) / ของเก่า (antique)
เขา ประเมิน ค่าความเสี่ยง	He assesses the risk.	เขา (he) / ประเมิน (assess) / ค่า (value) / ความเสี่ยง (risk)
ครู ประเมินผล นักเรียน	The teacher evaluates the students.	ครู (teacher) / ประเมินผล (evaluate) / นักเรียน (student)
เธอ ประสบ ความสำเร็จ	She succeeded.	เธอ (she) / ประสบ (achieve) / ความสำเร็จ (success)
เรา ควร ประหยัด เงิน	We should save money.	เรา (we) / ควร (should) / ประหยัด (save) / เงิน (money)
เขา ปรับ ตัว เรียบร้อยแล้ว	He has already adjusted.	เขา (he) / ปรับ (adjust) / ตัว (oneself) / เรียบร้อย (already) / แล้ว (already)
ตอนเช้า พระอาทิตย์ ปรากฏ	In the morning, the sun appears.	ตอนเช้า (in the morning) / พระอาทิตย์ (sun) / ปรากฏ (appears)
ฉัน เรียน จบ ปริญญา	I graduated with a degree.	ฉัน (I) / เรียน (study) / จบ (graduate) / ปริญญา (degree)
ขอ ปรึกษา หน่อย ครับ	May I have some advice, please?	ขอ (may I) / ปรึกษา (consult) / หน่อย (a little) / ครับ (sir)
ปลอกหมอน สีแดง สวย	The red pillowcase is beautiful.	ปลอกหมอน (pillowcase) / สีแดง (red) / สวย (beautiful)
แม่ ป้อนข้าว ลูก	The mother feeds the child.	แม่ (mother) / ป้อน (feed) / ข้าว (rice) / ลูก (child)
แอปเปิ้ล หนัก สอง ปอนด์	The apple weighs two pounds.	แอปเปิ้ล (apple) / หนัก (weigh) / สอง (two) / ปอนด์ (pounds)
ปัจจัย สำคัญ ใน ชีวิต	Important factors in life.	ปัจจัย (factor) / สำคัญ (important) / ใน (in) / ชีวิต (life)
ปั่น จักรยาน ทุกเช้า	Ride a bike every morning.	ปั่น (ride) / จักรยาน (bicycle) / ทุก (every) / เช้า (morning)
ปั้น ดิน เป็น หม้อ	Molding clay into a pot.	ปั้น (mold) / ดิน (clay) / เป็น (into) / หม้อ (pot)
ปั๊ม น้ำ อยู่ ที่ไหน	Where is the water pump?	ปั๊ม (pump) / น้ำ (water) / อยู่ (is) / ที่ไหน (where)
รอ ฉัน ที่ ปากซอย	Wait for me at the entrance of the alley.	รอ (wait) / ฉัน (me) / ที่ (at) / ปากซอย (the alley entrance)
เมืองไทย มี ป่าไม้	Thailand has forests.	เมือง (city) / ไทย (Thai) / มี (have) / ป่า (forest) / ไม้ (wood)
นก มี ปีก สวย งาม	The bird has beautiful wings.	นก (bird) / มี (has) / ปีก (wings) / สวยงาม (beautiful)
เขา พก ปืนพก	He carries a pistol.	เขา (he) / พก (carry) / ปืนพก (pistol)
เขา เป็นไข้ สูง	He has a high fever.	เขา (he) / เป็น (is) / ไข้ (fever) / สูง (high)
ผลไม้ เช่น กล้วย เป็นต้น	Fruits such as bananas, for example.	ผลไม้ (fruit) / เช่น (such as) / กล้วย (banana) / เป็นต้น (etc.)
เขา เป็นหนี้ มาก	He is in a lot of debt.	เขา (he) / เป็นหนี้ (is in debt) / มาก (a lot)
เรา มี เป้าหมาย ใหม่	We have a new goal.	เรา (we) / มี (have) / เป้าหมาย (goal) / ใหม่ (new)
เขา เปิดเผย ความจริง	He revealed the truth.	เขา (he) / เปิดเผย (revealed) / ความจริง (the truth)
เสื้อ ผ้า เปียก น้ำ	Wet clothes.	เสื้อ (shirt) / ผ้า (cloth) / เปียก (wet) / น้ำ (water)
อย่าลืม แปรงฟัน นะ	Don't forget to brush your teeth.	อย่า (don't) / ลืม (forget) / แปรง (brush) / ฟัน (teeth) / นะ (okay)
เขา ดู แปลกใจ	He looks surprised.	เขา (he) / ดู (look) / แปลกใจ (surprised)
แปลง ดิน เป็น สวน	Transform soil into a garden.	แปลง (convert) / ดิน (soil) / เป็น (into) / สวน (garden)
โปรแกรม นี้ ช่วย ได้	This program helps.	โปรแกรม (program) / นี้ (this) / ช่วย (help) / ได้ (can)
